{
  "schemaVersion": "1.0.0",
  "id": "product-promotion-message-led-sparse-v1-direction-02",
  "evaluationCaseId": "product-promotion-message-led-sparse-v1",
  "layout": {
    "provenance": "channel-content-os art-direction/engine.ts's real CompositionMode vocabulary -- CLINICAL_LEVELS (tiered, ruled information zones) combined with an asymmetric left-text/right-image split. Discarded: centered/symmetric framing, which CLINICAL_LEVELS' tiered-zone idea structurally argues against."
  },
  "typography": {
    "candidateFamily": "IBM Plex Sans",
    "licenseNote": "SIL OFL 1.1, verified live from google/fonts' bundled OFL.txt -- evaluation use only, not registered in channel-content-os's production fonts table.",
    "productionApproved": false
  },
  "artDirection": {
    "compositionMode": "CLINICAL_LEVELS",
    "ground": "paper-light",
    "thesis": "A structured, ruled information hierarchy reads as technical/systematic while the product commands the right column."
  },
  "artifact": {
    "kind": "EXTERNAL_EVALUATION_HISTORY",
    "description": "Rendered PNG (kaduse-product-promo-v2-direction-02.png, 1080x1440) delivered to the human reviewer for visual inspection; not copied into canonical repo storage in this batch."
  },
  "status": "CANDIDATE",
  "createdAt": "2026-09-04T00:00:00.000Z"
}
